{
  "schema_version": 1,
  "id": "coprime-paths",
  "title": "Coprime paths: the nine-edge threshold, linear bounds, and reproducible evidence",
  "version": "2026.10.20",
  "authors": [
    {
      "given_names": "Alexander Richard",
      "family_names": "Towell",
      "orcid": "0000-0001-6443-9897",
      "affiliation": "Southern Illinois University Edwardsville",
      "email": "lex@metafunctor.com"
    }
  ],
  "abstract": "The coprime graph on 1,...,17 forces a monochromatic simple nine-edge path in every two-edge-coloring, while a complete coloring at 16 avoids one. The upper bound combines a written extremal classification with independently checked finite host lemmas. The record also preserves earlier independently recertified seven- and eight-edge thresholds, linear bounds, an author-revised manuscript, and clearly separated exploratory findings. Human mathematical review and novelty assessment remain incomplete.",
  "keywords": [
    "coprime graph",
    "Ramsey theory",
    "monochromatic paths",
    "extremal graph theory",
    "finite certificates",
    "reproducible research",
    "written mathematical proof"
  ],
  "licenses": {
    "code": "MIT",
    "papers": "CC-BY-4.0"
  },
  "source": {
    "repository": "https://github.com/queelius/computational-explorations",
    "commit": "1e00700a86bbb13c4b0800eaa9a708b857c8e439",
    "evidence_commit": "8bda81e8d3f867bb1450b0e492592164416ba98f"
  },
  "claims": [
    {
      "id": "nine-edge-threshold",
      "statement": "P_cop(9) = 17.",
      "status": "written_proof",
      "evidence": [
        "docs-coprime-path-nine-resolution-2026-10-18-md",
        "docs-audits-coprime-path-nine-resolution-2026-10-18-lower-n16-k9-json",
        "docs-audits-coprime-path-nine-2026-10-18-cuts-json-gz",
        "docs-audits-coprime-path-nine-2026-10-18-fault-families-json-gz",
        "docs-audits-coprime-path-nine-2026-10-18-extensions-json-gz"
      ]
    },
    {
      "id": "earlier-thresholds",
      "statement": "Earlier public values P_cop(7) = P_cop(8) = 13 independently recertified.",
      "status": "prior_result_reverified",
      "evidence": [
        "docs-audits-coprime-paths-2026-10-18-manifest-json"
      ]
    },
    {
      "id": "linear-bounds",
      "statement": "2 <= liminf P_cop(k)/k <= limsup P_cop(k)/k <= 197*pi^2/595.",
      "status": "written_proof",
      "evidence": [
        "docs-coprime-path-structure-2026-10-18-md",
        "src-coprime-path-bounds-py"
      ]
    }
  ],
  "assumptions": [
    "G_n has vertices 1,...,n and an edge between distinct coprime integers.",
    "Two edge colors; simple paths; P_cop(k) counts edges.",
    "P_j in the extremal graph sources counts vertices. Published source hypotheses are part of the written proof."
  ],
  "limitations": [
    "The complete mathematical deduction is written, not formally verified.",
    "No new nine-edge SAT UNSAT certificate or Lean proof.",
    "Human mathematical review is pending; separate AI review is not human peer review.",
    "No established novelty or legal priority claim; the infinite odd-path formula remains unresolved.",
    "Earlier software and original-paper DOI versions do not contain this follow-up; cite the contribution-specific archive version.",
    "Exploratory endpoint and matching notes are not dependencies of the main proof.",
    "Historical manifests may refer to earlier CI configurations in their pinned repository commits; the packet contains the inputs for its listed reproduction commands.",
    "The archival packet excludes the journal's e-jc.sty template. The author's PDF and LaTeX are retained unchanged; rebuilding the journal layout requires obtaining that template separately. The written proof and listed computational checks are self-contained.",
    "October 21 literature follow-up resolved the structural overlap: the bound and equality uniqueness follow from published Ma–Yuan work. The archived author manuscript predates this attribution; consult the current short proof and assessment. Novelty of the coprime application remains bounded-search only."
  ],
  "credits": [
    "Alexander Richard Towell: author and prior coprime Ramsey investigations. Earlier reported path values are retained as prior results, not new discoveries.",
    "Du, Xi, Deng, and Ma, arXiv:2605.26815: external work citing the earlier repository and contextualizing edge-coprime Ramsey numbers.",
    "Erdos-Gallai, Balister-Gyori-Lehel-Schelp, Furedi-Kostochka-Verstraete, Furedi-Kostochka-Luo-Verstraete, Ali-Staton, Bondy-Chvatal, and Chvatal: published graph-theoretic ingredients cited in the proof and manuscript.",
    "Electronic Journal of Combinatorics: manuscript formatting template, excluded from this archival packet. Tutte-Berge and the credited exposition in the matching note: auxiliary matching argument.",
    "Ma and Yuan, A Stability Result of the Posa Lemma, SIAM J. Discrete Math. 38(2) (2024), 1757–1783, DOI 10.1137/20M1382143: equality refinement stated as Theorem 3 in Yuan, E-JC 31(4) (2024), P4.64, DOI 10.37236/12322. The full connected P10-free classification for n>=12 is an immediate corollary; equality uniqueness is not claimed as new."
  ],
  "ai_assistance": "Substantial OpenAI Codex assistance in investigation, written arguments, programming, certificate generation and checking, editorial preparation, organization, and independent AI review. The author supplied the October 20 manuscript revision; human mathematical verification remains pending.",
  "review": {
    "human": "pending",
    "formal_proof": false,
    "novelty": "bounded_search_only",
    "ai_review": "Separate AI reviews checked the written proof, source hypotheses, finite certificates, and manuscript revisions. The October 21 follow-up located the exact equality refinement: Ma–Yuan, as stated in Yuan (2024), Theorem 3. The complete n>=12 classification is a direct corollary, not a new structural result. See docs/coprime-path-equality-family-2026-10-21.md and docs/coprime-paths-contribution-assessment-2026-10-21.md; these findings are outside the October 20 archive. Human review remains pending.",
    "verification": "Earlier PR #9 and organization CI checks are preserved in the audits. Archival staging replayed all 180 packaged scientific tests, 10 auxiliary tests, standalone nine-edge host certificates, and the complete earlier eight-edge DRAT proof. The consolidated checkout also passed 142 focused tooling/scientific tests. These checks do not establish every written deduction or external theorem."
  },
  "events": [
    {
      "kind": "public_disclosure",
      "date": "2026-10-18",
      "timestamp": "2026-10-18T06:05:58Z",
      "url": "https://github.com/queelius/computational-explorations/pull/4",
      "scope": "Independent certification of earlier public seven- and eight-edge values; not the original disclosure of those values."
    },
    {
      "kind": "public_disclosure",
      "date": "2026-10-18",
      "timestamp": "2026-10-18T06:55:24Z",
      "url": "https://github.com/queelius/computational-explorations/pull/5",
      "scope": "Linear bounds and exact density calculator; a dated public event, not an exhaustive earliest-priority determination."
    },
    {
      "kind": "public_disclosure",
      "date": "2026-10-18",
      "timestamp": "2026-10-18T09:14:02Z",
      "url": "https://github.com/queelius/computational-explorations/pull/9",
      "scope": "Written proof of P_cop(9)=17 and associated evidence."
    },
    {
      "kind": "repository_acceptance",
      "date": "2026-10-18",
      "timestamp": "2026-10-18T09:39:50Z",
      "url": "https://github.com/queelius/computational-explorations/pull/9",
      "scope": "Merged as 8bda81e8d3f867bb1450b0e492592164416ba98f; repository acceptance only."
    },
    {
      "kind": "author_revision",
      "date": "2026-10-20",
      "scope": "Author-supplied LaTeX imported byte for byte; this is a local editorial event, not a public disclosure assertion.",
      "evidence": "research/records/coprime-paths/author-revision.json"
    },
    {
      "kind": "verification",
      "date": "2026-10-20",
      "scope": "Relevant unit/integration tests and selected exploratory replay tests passed during promotion.",
      "evidence": "research/records/coprime-paths/promotion-verification.json"
    },
    {
      "kind": "public_disclosure",
      "date": "2026-10-20",
      "timestamp": "2026-10-20T10:08:50Z",
      "url": "https://github.com/queelius/computational-explorations/pull/11",
      "scope": "Author-revised manuscript, selected auxiliary findings, contribution records, and reproducible packaging."
    },
    {
      "kind": "repository_acceptance",
      "date": "2026-10-20",
      "timestamp": "2026-10-20T10:31:17Z",
      "url": "https://github.com/queelius/computational-explorations/pull/11",
      "scope": "Merged as 3809ed703d27108d072b8daaaca09a90b4ef74b0; 6,224 routine CI tests and all five verification jobs passed. Repository acceptance is separate from human mathematical review."
    },
    {
      "kind": "verification",
      "date": "2026-10-20",
      "scope": "After checkout consolidation, 142 focused unit/integration tests passed; record tooling statement coverage 92%. Archive selection validates 79 pinned files and excludes the journal style.",
      "evidence": "research/records/coprime-paths/archive/preparation.json"
    },
    {
      "kind": "archive_publication",
      "date": "2026-10-20",
      "timestamp": "2026-10-20T11:41:48.469074+00:00",
      "url": "https://doi.org/10.5281/zenodo.23497967",
      "scope": "Published the evidence packet, unchanged manuscript PDF, archive note, citation, and verification receipt. All five public downloads match local SHA-256 hashes. Timestamp records the successful publication observation, separately from earlier disclosures.",
      "evidence": "research/records/coprime-paths/archive/publication.json"
    },
    {
      "kind": "verification",